{
  "schema": "advogadoja.componente.reutilizavel.v2-proposta",
  "identidade": {
    "id": "cmp.cliente.onboarding.localizacao.j1_advogado.v01",
    "nome": "Onboarding · localização · jornada advogado",
    "tipo": "componente",
    "versao": "1.0.0"
  },
  "estrutura": {
    "formato": "arvore_elementos",
    "arvore": [
      {
        "id": "cmp.cliente.onboarding.localizacao.j1_advogado.v01::1",
        "tag": "div",
        "atributos": {
          "class": "screen-runtime"
        },
        "filhos": [
          {
            "id": "cmp.cliente.onboarding.localizacao.j1_advogado.v01::2",
            "tag": "div",
            "atributos": {
              "class": "prototype-screen"
            },
            "filhos": [
              {
                "id": "cmp.cliente.onboarding.localizacao.j1_advogado.v01::3",
                "tag": "div",
                "atributos": {
                  "class": "screen-slot screen-slot--header",
                  "data-slot": "header"
                },
                "filhos": [
                  {
                    "id": "cmp.cliente.onboarding.localizacao.j1_advogado.v01::4",
                    "tag": "header",
                    "atributos": {
                      "class": "topbar"
                    },
                    "filhos": [
                      {
                        "id": "cmp.cliente.onboarding.localizacao.j1_advogado.v01::5",
                        "tag": "img",
                        "atributos": {
                          "src": "data:image/svg+xml;base64,PHN2ZyB4bWxucz0iaHR0cDovL3d3dy53My5vcmcvMjAwMC9zdmciIHZpZXdCb3g9IjAgMCAxMDAgMTAwIiByb2xlPSJpbWciIGFyaWEtbGFiZWxsZWRieT0idGl0bGUiPgogIDx0aXRsZSBpZD0idGl0bGUiPlPDrW1ib2xvIEFkdm9nYWRvSsOhPC90aXRsZT4KICA8ZyBmaWxsPSJub25lIiBzdHJva2U9IiNmZmZmZmYiIHN0cm9rZS13aWR0aD0iMi42IiBzdHJva2UtbGluZWNhcD0icm91bmQiIHN0cm9rZS1saW5lam9pbj0icm91bmQiPgogICAgPHBhdGggZD0iTTUwIDdDMzQuOCA3IDIzIDE4LjcgMjMgMzQuMmMwIDE3IDI3IDQ2LjggMjcgNDYuOHMyNy0yOS44IDI3LTQ2LjhDNzcgMTguNyA2NS4yIDcgNTAgN1oiLz4KICAgIDxjaXJjbGUgY3g9IjUwIiBjeT0iMzQiIHI9IjkuMyIvPgogICAgPHBhdGggZD0iTTI4IDYwLjVDMTUuMSA2NC4xIDggNzAuMiA4IDc3LjIgOCA4OC42IDI2LjggOTcgNTAgOTdzNDItOC40IDQyLTE5LjhjMC03LTcuMS0xMy4xLTIwLTE2LjciLz4KICAgIDxwYXRoIGQ9Ik0zNS41IDY4LjJDMjcgNzAuNCAyMiA3NCAyMiA3OGMwIDYgMTIuNSAxMC41IDI4IDEwLjVTNzggODQgNzggNzhjMC00LTUtNy42LTEzLjUtOS44Ii8+CiAgPC9nPgo8L3N2Zz4K",
                          "alt": ""
                        },
                        "filhos": []
                      },
                      {
                        "id": "cmp.cliente.onboarding.localizacao.j1_advogado.v01::6",
                        "tag": "span",
                        "atributos": {},
                        "filhos": [
                          "AdvogadoJá+"
                        ]
                      }
                    ]
                  }
                ]
              },
              {
                "id": "cmp.cliente.onboarding.localizacao.j1_advogado.v01::7",
                "tag": "div",
                "atributos": {
                  "class": "screen-layout"
                },
                "filhos": [
                  {
                    "id": "cmp.cliente.onboarding.localizacao.j1_advogado.v01::8",
                    "tag": "div",
                    "atributos": {
                      "class": "screen-slot screen-slot--main",
                      "data-slot": "main"
                    },
                    "filhos": [
                      {
                        "id": "cmp.cliente.onboarding.localizacao.j1_advogado.v01::9",
                        "tag": "div",
                        "atributos": {
                          "class": "registration__shell"
                        },
                        "filhos": [
                          {
                            "id": "cmp.cliente.onboarding.localizacao.j1_advogado.v01::10",
                            "tag": "div",
                            "atributos": {
                              "class": "registration__intro"
                            },
                            "filhos": [
                              {
                                "id": "cmp.cliente.onboarding.localizacao.j1_advogado.v01::11",
                                "tag": "p",
                                "atributos": {
                                  "class": "eyebrow"
                                },
                                "filhos": [
                                  "Onboarding do Cliente"
                                ]
                              },
                              {
                                "id": "cmp.cliente.onboarding.localizacao.j1_advogado.v01::12",
                                "tag": "h1",
                                "atributos": {},
                                "filhos": [
                                  "Profissionais na sua região"
                                ]
                              },
                              {
                                "id": "cmp.cliente.onboarding.localizacao.j1_advogado.v01::13",
                                "tag": "p",
                                "atributos": {},
                                "filhos": [
                                  "Usamos a localização para organizar a busca por cidade, raio e modalidade. Você também pode informar a cidade manualmente."
                                ]
                              }
                            ]
                          },
                          {
                            "id": "cmp.cliente.onboarding.localizacao.j1_advogado.v01::14",
                            "tag": "div",
                            "atributos": {
                              "class": "client-map",
                              "aria-label": "Mapa ilustrativo"
                            },
                            "filhos": []
                          },
                          {
                            "id": "cmp.cliente.onboarding.localizacao.j1_advogado.v01::15",
                            "tag": "form",
                            "atributos": {
                              "class": "form-card",
                              "data-client-onboarding-form": ""
                            },
                            "filhos": [
                              {
                                "id": "cmp.cliente.onboarding.localizacao.j1_advogado.v01::16",
                                "tag": "div",
                                "atributos": {
                                  "class": "op-buttons"
                                },
                                "filhos": [
                                  {
                                    "id": "cmp.cliente.onboarding.localizacao.j1_advogado.v01::17",
                                    "tag": "button",
                                    "atributos": {
                                      "class": "button",
                                      "type": "submit",
                                      "data-action": "navegar.cliente.onboarding.preferencias_contato"
                                    },
                                    "filhos": [
                                      "Permitir localização e continuar"
                                    ]
                                  },
                                  {
                                    "id": "cmp.cliente.onboarding.localizacao.j1_advogado.v01::18",
                                    "tag": "button",
                                    "atributos": {
                                      "class": "op-secondary",
                                      "type": "submit",
                                      "data-action": "navegar.cliente.onboarding.preferencias_contato"
                                    },
                                    "filhos": [
                                      "Informar cidade manualmente"
                                    ]
                                  }
                                ]
                              },
                              {
                                "id": "cmp.cliente.onboarding.localizacao.j1_advogado.v01::19",
                                "tag": "p",
                                "atributos": {
                                  "class": "form-status",
                                  "aria-live": "polite"
                                },
                                "filhos": []
                              }
                            ]
                          }
                        ]
                      }
                    ]
                  }
                ]
              }
            ]
          }
        ]
      }
    ],
    "id": "html_cmp.cliente.onboarding.localizacao.j1_advogado.v01"
  },
  "estilos": {
    "css": "/* Cabeçalho: sem estilos exclusivos; utiliza a folha do componente principal. */\n\n/* cliente.onboarding.localizacao · Cliente · Onboarding · Localização */\n\n/* arquivo local da tela; mantenha aqui apenas ajustes específicos deste HTML isolado */\n",
    "id": "css_cmp.cliente.onboarding.localizacao.j1_advogado.v01"
  },
  "interface": {
    "propriedadesAceitas": [],
    "eventosEmitidos": [
      "interacao_simulada"
    ],
    "regraBinding": "Interações são interpretadas pelo motor de prévia a partir de atributos data-*; o componente não consulta arquivos externos."
  },
  "classificacao": {
    "escopo": "advogado",
    "jornadas": [
      "advogado"
    ],
    "localizacaoArvore": {
      "secao": "Componentes",
      "segmentos": [
        "importados",
        "projeto1",
        "cliente",
        "onboarding",
        "localizacao"
      ],
      "chave": "j1_advogado"
    }
  }
}
