{
  "schema": "advogadoja.componente.reutilizavel.v2-proposta",
  "identidade": {
    "id": "cmp.cliente.onboarding.concluido.perfil_cliente.v01",
    "nome": "Cliente · Onboarding concluído · jornada cliente",
    "tipo": "componente",
    "versao": "1.0.0"
  },
  "estrutura": {
    "formato": "arvore_elementos",
    "arvore": [
      {
        "id": "cmp.cliente.onboarding.concluido.perfil_cliente.v01::1",
        "tag": "div",
        "atributos": {
          "class": "screen-runtime"
        },
        "filhos": [
          {
            "id": "cmp.cliente.onboarding.concluido.perfil_cliente.v01::2",
            "tag": "div",
            "atributos": {
              "class": "prototype-screen"
            },
            "filhos": [
              {
                "id": "cmp.cliente.onboarding.concluido.perfil_cliente.v01::3",
                "tag": "div",
                "atributos": {
                  "class": "screen-slot screen-slot--header",
                  "data-slot": "header"
                },
                "filhos": [
                  {
                    "id": "cmp.cliente.onboarding.concluido.perfil_cliente.v01::4",
                    "tag": "header",
                    "atributos": {
                      "class": "topbar"
                    },
                    "filhos": [
                      {
                        "id": "cmp.cliente.onboarding.concluido.perfil_cliente.v01::5",
                        "tag": "img",
                        "atributos": {
                          "src": "data:image/svg+xml;base64,PHN2ZyB4bWxucz0iaHR0cDovL3d3dy53My5vcmcvMjAwMC9zdmciIHZpZXdCb3g9IjAgMCAxMDAgMTAwIiByb2xlPSJpbWciIGFyaWEtbGFiZWxsZWRieT0idGl0bGUiPgogIDx0aXRsZSBpZD0idGl0bGUiPlPDrW1ib2xvIEFkdm9nYWRvSsOhPC90aXRsZT4KICA8ZyBmaWxsPSJub25lIiBzdHJva2U9IiNmZmZmZmYiIHN0cm9rZS13aWR0aD0iMi42IiBzdHJva2UtbGluZWNhcD0icm91bmQiIHN0cm9rZS1saW5lam9pbj0icm91bmQiPgogICAgPHBhdGggZD0iTTUwIDdDMzQuOCA3IDIzIDE4LjcgMjMgMzQuMmMwIDE3IDI3IDQ2LjggMjcgNDYuOHMyNy0yOS44IDI3LTQ2LjhDNzcgMTguNyA2NS4yIDcgNTAgN1oiLz4KICAgIDxjaXJjbGUgY3g9IjUwIiBjeT0iMzQiIHI9IjkuMyIvPgogICAgPHBhdGggZD0iTTI4IDYwLjVDMTUuMSA2NC4xIDggNzAuMiA4IDc3LjIgOCA4OC42IDI2LjggOTcgNTAgOTdzNDItOC40IDQyLTE5LjhjMC03LTcuMS0xMy4xLTIwLTE2LjciLz4KICAgIDxwYXRoIGQ9Ik0zNS41IDY4LjJDMjcgNzAuNCAyMiA3NCAyMiA3OGMwIDYgMTIuNSAxMC41IDI4IDEwLjVTNzggODQgNzggNzhjMC00LTUtNy42LTEzLjUtOS44Ii8+CiAgPC9nPgo8L3N2Zz4K",
                          "alt": ""
                        },
                        "filhos": []
                      },
                      {
                        "id": "cmp.cliente.onboarding.concluido.perfil_cliente.v01::6",
                        "tag": "span",
                        "atributos": {},
                        "filhos": [
                          "AdvogadoJá+"
                        ]
                      }
                    ]
                  }
                ]
              },
              {
                "id": "cmp.cliente.onboarding.concluido.perfil_cliente.v01::7",
                "tag": "div",
                "atributos": {
                  "class": "screen-layout"
                },
                "filhos": [
                  {
                    "id": "cmp.cliente.onboarding.concluido.perfil_cliente.v01::8",
                    "tag": "div",
                    "atributos": {
                      "class": "screen-slot screen-slot--main",
                      "data-slot": "main"
                    },
                    "filhos": [
                      {
                        "id": "cmp.cliente.onboarding.concluido.perfil_cliente.v01::9",
                        "tag": "div",
                        "atributos": {
                          "class": "registration__shell success-shell"
                        },
                        "filhos": [
                          {
                            "id": "cmp.cliente.onboarding.concluido.perfil_cliente.v01::10",
                            "tag": "div",
                            "atributos": {
                              "class": "success-mark",
                              "aria-hidden": "true"
                            },
                            "filhos": [
                              "✓"
                            ]
                          },
                          {
                            "id": "cmp.cliente.onboarding.concluido.perfil_cliente.v01::11",
                            "tag": "p",
                            "atributos": {
                              "class": "eyebrow"
                            },
                            "filhos": [
                              "Onboarding do Cliente"
                            ]
                          },
                          {
                            "id": "cmp.cliente.onboarding.concluido.perfil_cliente.v01::12",
                            "tag": "h1",
                            "atributos": {},
                            "filhos": [
                              "Preferências concluídas"
                            ]
                          },
                          {
                            "id": "cmp.cliente.onboarding.concluido.perfil_cliente.v01::13",
                            "tag": "p",
                            "atributos": {},
                            "filhos": [
                              "O cadastro pessoal já foi feito na jornada compartilhada. A partir daqui o Cliente entra na sua Home."
                            ]
                          },
                          {
                            "id": "cmp.cliente.onboarding.concluido.perfil_cliente.v01::14",
                            "tag": "div",
                            "atributos": {
                              "class": "form-note"
                            },
                            "filhos": [
                              {
                                "id": "cmp.cliente.onboarding.concluido.perfil_cliente.v01::15",
                                "tag": "strong",
                                "atributos": {},
                                "filhos": [
                                  "Pronto para começar"
                                ]
                              },
                              {
                                "id": "cmp.cliente.onboarding.concluido.perfil_cliente.v01::16",
                                "tag": "span",
                                "atributos": {},
                                "filhos": [
                                  "Localização e preferência de contato já foram revisadas."
                                ]
                              }
                            ]
                          },
                          {
                            "id": "cmp.cliente.onboarding.concluido.perfil_cliente.v01::17",
                            "tag": "button",
                            "atributos": {
                              "class": "button",
                              "type": "button",
                              "data-action": "navegar.cliente.home_cliente"
                            },
                            "filhos": [
                              "Ir para a Home do Cliente"
                            ]
                          }
                        ]
                      }
                    ]
                  }
                ]
              }
            ]
          }
        ]
      }
    ],
    "id": "html_cmp.cliente.onboarding.concluido.perfil_cliente.v01"
  },
  "estilos": {
    "css": "/* Cabeçalho: sem estilos exclusivos; utiliza a folha do componente principal. */\n\n/* cliente.onboarding.concluido · Cliente · Onboarding concluído */\n\n/* arquivo local da tela; mantenha aqui apenas ajustes específicos deste HTML isolado */\n",
    "id": "css_cmp.cliente.onboarding.concluido.perfil_cliente.v01"
  },
  "interface": {
    "propriedadesAceitas": [],
    "eventosEmitidos": [
      "interacao_simulada"
    ],
    "regraBinding": "Interações são interpretadas pelo motor de prévia a partir de atributos data-*; o componente não consulta arquivos externos."
  },
  "classificacao": {
    "escopo": "cliente",
    "jornadas": [
      "cliente"
    ],
    "localizacaoArvore": {
      "secao": "Componentes",
      "segmentos": [
        "visuais",
        "cliente",
        "onboarding",
        "concluido"
      ],
      "chave": "perfil_cliente"
    }
  }
}
