{
  "schema": "advogadoja.componente.reutilizavel.v2-proposta",
  "identidade": {
    "id": "cmp.advogado.assinatura.gestao_assinatura.j1_administrador.v01",
    "nome": "Gestão da assinatura · jornada administrador",
    "tipo": "componente",
    "versao": "1.0.0"
  },
  "estrutura": {
    "formato": "arvore_elementos",
    "arvore": [
      {
        "id": "cmp.advogado.assinatura.gestao_assinatura.j1_administrador.v01::1",
        "tag": "div",
        "atributos": {
          "class": "screen-runtime"
        },
        "filhos": [
          {
            "id": "cmp.advogado.assinatura.gestao_assinatura.j1_administrador.v01::2",
            "tag": "div",
            "atributos": {
              "class": "prototype-screen operational"
            },
            "filhos": [
              {
                "id": "cmp.advogado.assinatura.gestao_assinatura.j1_administrador.v01::3",
                "tag": "div",
                "atributos": {
                  "class": "app-header"
                },
                "filhos": [
                  {
                    "id": "cmp.advogado.assinatura.gestao_assinatura.j1_administrador.v01::4",
                    "tag": "div",
                    "atributos": {},
                    "filhos": []
                  },
                  {
                    "id": "cmp.advogado.assinatura.gestao_assinatura.j1_administrador.v01::5",
                    "tag": "div",
                    "atributos": {
                      "class": "app-brand"
                    },
                    "filhos": [
                      {
                        "id": "cmp.advogado.assinatura.gestao_assinatura.j1_administrador.v01::6",
                        "tag": "strong",
                        "atributos": {},
                        "filhos": [
                          "AdvogadoJá"
                        ]
                      }
                    ]
                  },
                  {
                    "id": "cmp.advogado.assinatura.gestao_assinatura.j1_administrador.v01::7",
                    "tag": "div",
                    "atributos": {
                      "class": "app-role"
                    },
                    "filhos": [
                      "Advogado"
                    ]
                  }
                ]
              },
              {
                "id": "cmp.advogado.assinatura.gestao_assinatura.j1_administrador.v01::8",
                "tag": "div",
                "atributos": {
                  "class": "app-titlebar"
                },
                "filhos": [
                  "Gestão da assinatura"
                ]
              },
              {
                "id": "cmp.advogado.assinatura.gestao_assinatura.j1_administrador.v01::9",
                "tag": "div",
                "atributos": {
                  "class": "screen-layout"
                },
                "filhos": [
                  {
                    "id": "cmp.advogado.assinatura.gestao_assinatura.j1_administrador.v01::10",
                    "tag": "div",
                    "atributos": {
                      "class": "screen-slot screen-slot--main"
                    },
                    "filhos": [
                      {
                        "id": "cmp.advogado.assinatura.gestao_assinatura.j1_administrador.v01::11",
                        "tag": "main",
                        "atributos": {
                          "class": "op-shell"
                        },
                        "filhos": [
                          {
                            "id": "cmp.advogado.assinatura.gestao_assinatura.j1_administrador.v01::12",
                            "tag": "div",
                            "atributos": {
                              "class": "op-card"
                            },
                            "filhos": [
                              {
                                "id": "cmp.advogado.assinatura.gestao_assinatura.j1_administrador.v01::13",
                                "tag": "h2",
                                "atributos": {},
                                "filhos": [
                                  "Plano none"
                                ]
                              },
                              {
                                "id": "cmp.advogado.assinatura.gestao_assinatura.j1_administrador.v01::14",
                                "tag": "p",
                                "atributos": {},
                                "filhos": [
                                  "Status oficial none"
                                ]
                              }
                            ]
                          },
                          {
                            "id": "cmp.advogado.assinatura.gestao_assinatura.j1_administrador.v01::15",
                            "tag": "div",
                            "atributos": {
                              "class": "op-buttons"
                            },
                            "filhos": [
                              {
                                "id": "cmp.advogado.assinatura.gestao_assinatura.j1_administrador.v01::16",
                                "tag": "button",
                                "atributos": {
                                  "class": "button",
                                  "type": "button",
                                  "data-goto": "advogado.assinatura.planos"
                                },
                                "filhos": [
                                  "Ver planos"
                                ]
                              },
                              {
                                "id": "cmp.advogado.assinatura.gestao_assinatura.j1_administrador.v01::17",
                                "tag": "button",
                                "atributos": {
                                  "class": "op-secondary",
                                  "type": "button",
                                  "data-goto": "advogado.assinatura.historico_assinatura"
                                },
                                "filhos": [
                                  "Histórico de assinatura"
                                ]
                              }
                            ]
                          },
                          {
                            "id": "cmp.advogado.assinatura.gestao_assinatura.j1_administrador.v01::18",
                            "tag": "div",
                            "atributos": {
                              "class": "op-toast",
                              "role": "status",
                              "aria-live": "polite"
                            },
                            "filhos": []
                          }
                        ]
                      }
                    ]
                  }
                ]
              }
            ]
          }
        ]
      }
    ],
    "id": "html_cmp.advogado.assinatura.gestao_assinatura.j1_administrador.v01"
  },
  "estilos": {
    "css": "/* advogado.assinatura.gestao_assinatura · Assinatura */\n\n/* arquivo local da tela; mantenha aqui apenas ajustes específicos deste HTML isolado */\n",
    "id": "css_cmp.advogado.assinatura.gestao_assinatura.j1_administrador.v01"
  },
  "interface": {
    "propriedadesAceitas": [],
    "eventosEmitidos": [
      "interacao_simulada"
    ],
    "regraBinding": "Interações são interpretadas pelo motor de prévia a partir de atributos data-*; o componente não consulta arquivos externos."
  },
  "classificacao": {
    "escopo": "administrador",
    "jornadas": [
      "administrador"
    ],
    "localizacaoArvore": {
      "secao": "Componentes",
      "segmentos": [
        "importados",
        "projeto1",
        "advogado",
        "assinatura",
        "gestao_assinatura"
      ],
      "chave": "j1_administrador"
    }
  }
}
