{
  "schema": "advogadoja.componente.reutilizavel.v2-proposta",
  "identidade": {
    "id": "cmp.auth.inicializacao.splash.perfil_advogado.v01",
    "nome": "Splash · jornada advogado",
    "tipo": "componente",
    "versao": "1.0.0"
  },
  "estrutura": {
    "formato": "arvore_elementos",
    "arvore": [
      {
        "id": "cmp.auth.inicializacao.splash.perfil_advogado.v01::1",
        "tag": "div",
        "atributos": {
          "class": "screen-runtime"
        },
        "filhos": [
          {
            "id": "cmp.auth.inicializacao.splash.perfil_advogado.v01::2",
            "tag": "div",
            "atributos": {
              "class": "splash"
            },
            "filhos": [
              {
                "id": "cmp.auth.inicializacao.splash.perfil_advogado.v01::3",
                "tag": "div",
                "atributos": {
                  "class": "screen-layout"
                },
                "filhos": [
                  {
                    "id": "cmp.auth.inicializacao.splash.perfil_advogado.v01::4",
                    "tag": "div",
                    "atributos": {
                      "class": "screen-slot screen-slot--main",
                      "data-slot": "main"
                    },
                    "filhos": [
                      {
                        "id": "cmp.auth.inicializacao.splash.perfil_advogado.v01::5",
                        "tag": "div",
                        "atributos": {},
                        "filhos": [
                          {
                            "id": "cmp.auth.inicializacao.splash.perfil_advogado.v01::6",
                            "tag": "div",
                            "atributos": {
                              "class": "mark"
                            },
                            "filhos": [
                              {
                                "id": "cmp.auth.inicializacao.splash.perfil_advogado.v01::7",
                                "tag": "img",
                                "atributos": {
                                  "src": "data:image/svg+xml;base64,PHN2ZyB4bWxucz0iaHR0cDovL3d3dy53My5vcmcvMjAwMC9zdmciIHZpZXdCb3g9IjAgMCAxMDAgMTAwIiByb2xlPSJpbWciIGFyaWEtbGFiZWxsZWRieT0idGl0bGUiPgogIDx0aXRsZSBpZD0idGl0bGUiPlPDrW1ib2xvIEFkdm9nYWRvSsOhPC90aXRsZT4KICA8ZyBmaWxsPSJub25lIiBzdHJva2U9IiNmZmZmZmYiIHN0cm9rZS13aWR0aD0iMi42IiBzdHJva2UtbGluZWNhcD0icm91bmQiIHN0cm9rZS1saW5lam9pbj0icm91bmQiPgogICAgPHBhdGggZD0iTTUwIDdDMzQuOCA3IDIzIDE4LjcgMjMgMzQuMmMwIDE3IDI3IDQ2LjggMjcgNDYuOHMyNy0yOS44IDI3LTQ2LjhDNzcgMTguNyA2NS4yIDcgNTAgN1oiLz4KICAgIDxjaXJjbGUgY3g9IjUwIiBjeT0iMzQiIHI9IjkuMyIvPgogICAgPHBhdGggZD0iTTI4IDYwLjVDMTUuMSA2NC4xIDggNzAuMiA4IDc3LjIgOCA4OC42IDI2LjggOTcgNTAgOTdzNDItOC40IDQyLTE5LjhjMC03LTcuMS0xMy4xLTIwLTE2LjciLz4KICAgIDxwYXRoIGQ9Ik0zNS41IDY4LjJDMjcgNzAuNCAyMiA3NCAyMiA3OGMwIDYgMTIuNSAxMC41IDI4IDEwLjVTNzggODQgNzggNzhjMC00LTUtNy42LTEzLjUtOS44Ii8+CiAgPC9nPgo8L3N2Zz4K",
                                  "alt": "AdvogadoJá+"
                                },
                                "filhos": []
                              }
                            ]
                          },
                          {
                            "id": "cmp.auth.inicializacao.splash.perfil_advogado.v01::8",
                            "tag": "h1",
                            "atributos": {},
                            "filhos": [
                              "AdvogadoJá"
                            ]
                          }
                        ]
                      }
                    ]
                  }
                ]
              }
            ]
          }
        ]
      }
    ],
    "id": "html_cmp.auth.inicializacao.splash.perfil_advogado.v01"
  },
  "estilos": {
    "css": "/* auth.inicializacao.splash · Splash */\n\n/* arquivo local da tela; mantenha aqui apenas ajustes específicos deste HTML isolado */\n",
    "id": "css_cmp.auth.inicializacao.splash.perfil_advogado.v01"
  },
  "interface": {
    "propriedadesAceitas": [],
    "eventosEmitidos": [
      "interacao_simulada"
    ],
    "regraBinding": "Interações são interpretadas pelo motor de prévia a partir de atributos data-*; o componente não consulta arquivos externos."
  },
  "classificacao": {
    "escopo": "advogado",
    "jornadas": [
      "advogado"
    ],
    "localizacaoArvore": {
      "secao": "Componentes",
      "segmentos": [
        "visuais",
        "auth",
        "inicializacao",
        "splash"
      ],
      "chave": "perfil_advogado"
    }
  }
}
