{
  "schema": "advogadoja.componente.reutilizavel.v2-proposta",
  "identidade": {
    "id": "cmp.advogado.assinatura.checkout.j1_advogado.v01",
    "nome": "Checkout · jornada advogado",
    "tipo": "componente",
    "versao": "1.0.0"
  },
  "estrutura": {
    "formato": "arvore_elementos",
    "arvore": [
      {
        "id": "cmp.advogado.assinatura.checkout.j1_advogado.v01::1",
        "tag": "div",
        "atributos": {
          "class": "screen-runtime"
        },
        "filhos": [
          {
            "id": "cmp.advogado.assinatura.checkout.j1_advogado.v01::2",
            "tag": "div",
            "atributos": {
              "class": "prototype-screen operational"
            },
            "filhos": [
              {
                "id": "cmp.advogado.assinatura.checkout.j1_advogado.v01::3",
                "tag": "div",
                "atributos": {
                  "class": "app-header"
                },
                "filhos": [
                  {
                    "id": "cmp.advogado.assinatura.checkout.j1_advogado.v01::4",
                    "tag": "div",
                    "atributos": {},
                    "filhos": []
                  },
                  {
                    "id": "cmp.advogado.assinatura.checkout.j1_advogado.v01::5",
                    "tag": "div",
                    "atributos": {
                      "class": "app-brand"
                    },
                    "filhos": [
                      {
                        "id": "cmp.advogado.assinatura.checkout.j1_advogado.v01::6",
                        "tag": "strong",
                        "atributos": {},
                        "filhos": [
                          "AdvogadoJá"
                        ]
                      }
                    ]
                  },
                  {
                    "id": "cmp.advogado.assinatura.checkout.j1_advogado.v01::7",
                    "tag": "div",
                    "atributos": {
                      "class": "app-role"
                    },
                    "filhos": [
                      "Advogado"
                    ]
                  }
                ]
              },
              {
                "id": "cmp.advogado.assinatura.checkout.j1_advogado.v01::8",
                "tag": "div",
                "atributos": {
                  "class": "app-titlebar"
                },
                "filhos": [
                  "Checkout"
                ]
              },
              {
                "id": "cmp.advogado.assinatura.checkout.j1_advogado.v01::9",
                "tag": "div",
                "atributos": {
                  "class": "screen-layout"
                },
                "filhos": [
                  {
                    "id": "cmp.advogado.assinatura.checkout.j1_advogado.v01::10",
                    "tag": "div",
                    "atributos": {
                      "class": "screen-slot screen-slot--main"
                    },
                    "filhos": [
                      {
                        "id": "cmp.advogado.assinatura.checkout.j1_advogado.v01::11",
                        "tag": "main",
                        "atributos": {
                          "class": "op-shell"
                        },
                        "filhos": [
                          {
                            "id": "cmp.advogado.assinatura.checkout.j1_advogado.v01::12",
                            "tag": "div",
                            "atributos": {
                              "class": "op-card"
                            },
                            "filhos": [
                              {
                                "id": "cmp.advogado.assinatura.checkout.j1_advogado.v01::13",
                                "tag": "h2",
                                "atributos": {},
                                "filhos": [
                                  "Stripe checkout"
                                ]
                              },
                              {
                                "id": "cmp.advogado.assinatura.checkout.j1_advogado.v01::14",
                                "tag": "p",
                                "atributos": {},
                                "filhos": [
                                  "O app cria a checkout session no backend o webhook assinado do s"
                                ]
                              }
                            ]
                          },
                          {
                            "id": "cmp.advogado.assinatura.checkout.j1_advogado.v01::15",
                            "tag": "button",
                            "atributos": {
                              "class": "button",
                              "type": "button",
                              "data-action-message": "Assinaturas indisponíveis na homologação."
                            },
                            "filhos": [
                              "Assinaturas indisponíveis na homologação"
                            ]
                          },
                          {
                            "id": "cmp.advogado.assinatura.checkout.j1_advogado.v01::16",
                            "tag": "button",
                            "atributos": {
                              "class": "op-secondary",
                              "type": "button",
                              "data-goto": "advogado.assinatura.retorno-checkout"
                            },
                            "filhos": [
                              "Simular retorno do checkout"
                            ]
                          },
                          {
                            "id": "cmp.advogado.assinatura.checkout.j1_advogado.v01::17",
                            "tag": "div",
                            "atributos": {
                              "class": "op-toast",
                              "role": "status",
                              "aria-live": "polite"
                            },
                            "filhos": []
                          }
                        ]
                      }
                    ]
                  }
                ]
              }
            ]
          }
        ]
      }
    ],
    "id": "html_cmp.advogado.assinatura.checkout.j1_advogado.v01"
  },
  "estilos": {
    "css": "/* advogado.assinatura.checkout · Pagamento */\n\n/* arquivo local da tela; mantenha aqui apenas ajustes específicos deste HTML isolado */\n",
    "id": "css_cmp.advogado.assinatura.checkout.j1_advogado.v01"
  },
  "interface": {
    "propriedadesAceitas": [],
    "eventosEmitidos": [
      "interacao_simulada"
    ],
    "regraBinding": "Interações são interpretadas pelo motor de prévia a partir de atributos data-*; o componente não consulta arquivos externos."
  },
  "classificacao": {
    "escopo": "advogado",
    "jornadas": [
      "advogado"
    ],
    "localizacaoArvore": {
      "secao": "Componentes",
      "segmentos": [
        "importados",
        "projeto1",
        "advogado",
        "assinatura",
        "checkout"
      ],
      "chave": "j1_advogado"
    }
  }
}
