{
  "schema": "advogadoja.componente.reutilizavel.v2-proposta",
  "identidade": {
    "id": "cmp.escritorio.distribuicao.distribuicao_interna.j1_advogado.v01",
    "nome": "Distribuição interna · jornada advogado",
    "tipo": "componente",
    "versao": "1.0.0"
  },
  "estrutura": {
    "formato": "arvore_elementos",
    "arvore": [
      {
        "id": "cmp.escritorio.distribuicao.distribuicao_interna.j1_advogado.v01::1",
        "tag": "div",
        "atributos": {
          "class": "screen-runtime"
        },
        "filhos": [
          {
            "id": "cmp.escritorio.distribuicao.distribuicao_interna.j1_advogado.v01::2",
            "tag": "div",
            "atributos": {
              "class": "prototype-screen operational"
            },
            "filhos": [
              {
                "id": "cmp.escritorio.distribuicao.distribuicao_interna.j1_advogado.v01::3",
                "tag": "div",
                "atributos": {
                  "class": "app-header"
                },
                "filhos": [
                  {
                    "id": "cmp.escritorio.distribuicao.distribuicao_interna.j1_advogado.v01::4",
                    "tag": "div",
                    "atributos": {},
                    "filhos": []
                  },
                  {
                    "id": "cmp.escritorio.distribuicao.distribuicao_interna.j1_advogado.v01::5",
                    "tag": "div",
                    "atributos": {
                      "class": "app-brand"
                    },
                    "filhos": [
                      {
                        "id": "cmp.escritorio.distribuicao.distribuicao_interna.j1_advogado.v01::6",
                        "tag": "strong",
                        "atributos": {},
                        "filhos": [
                          "AdvogadoJá"
                        ]
                      }
                    ]
                  },
                  {
                    "id": "cmp.escritorio.distribuicao.distribuicao_interna.j1_advogado.v01::7",
                    "tag": "div",
                    "atributos": {
                      "class": "app-role"
                    },
                    "filhos": [
                      "Advogado"
                    ]
                  }
                ]
              },
              {
                "id": "cmp.escritorio.distribuicao.distribuicao_interna.j1_advogado.v01::8",
                "tag": "div",
                "atributos": {
                  "class": "app-titlebar"
                },
                "filhos": [
                  "Distribuição interna"
                ]
              },
              {
                "id": "cmp.escritorio.distribuicao.distribuicao_interna.j1_advogado.v01::9",
                "tag": "div",
                "atributos": {
                  "class": "screen-layout"
                },
                "filhos": [
                  {
                    "id": "cmp.escritorio.distribuicao.distribuicao_interna.j1_advogado.v01::10",
                    "tag": "div",
                    "atributos": {
                      "class": "screen-slot screen-slot--main"
                    },
                    "filhos": [
                      {
                        "id": "cmp.escritorio.distribuicao.distribuicao_interna.j1_advogado.v01::11",
                        "tag": "main",
                        "atributos": {
                          "class": "op-shell"
                        },
                        "filhos": [
                          {
                            "id": "cmp.escritorio.distribuicao.distribuicao_interna.j1_advogado.v01::12",
                            "tag": "form",
                            "atributos": {
                              "class": "op-card op-form",
                              "data-prototype-form": "",
                              "data-success-message": "Estratégia salva na simulação."
                            },
                            "filhos": [
                              {
                                "id": "cmp.escritorio.distribuicao.distribuicao_interna.j1_advogado.v01::13",
                                "tag": "h2",
                                "atributos": {},
                                "filhos": [
                                  "Como distribuir solicitações"
                                ]
                              },
                              {
                                "id": "cmp.escritorio.distribuicao.distribuicao_interna.j1_advogado.v01::14",
                                "tag": "p",
                                "atributos": {},
                                "filhos": [
                                  "Esta regra organiza somente o fluxo interno do escritório"
                                ]
                              },
                              {
                                "id": "cmp.escritorio.distribuicao.distribuicao_interna.j1_advogado.v01::15",
                                "tag": "label",
                                "atributos": {},
                                "filhos": [
                                  "Estratégia",
                                  {
                                    "id": "cmp.escritorio.distribuicao.distribuicao_interna.j1_advogado.v01::16",
                                    "tag": "select",
                                    "atributos": {},
                                    "filhos": [
                                      {
                                        "id": "cmp.escritorio.distribuicao.distribuicao_interna.j1_advogado.v01::17",
                                        "tag": "option",
                                        "atributos": {},
                                        "filhos": [
                                          "Distribuição manual"
                                        ]
                                      }
                                    ]
                                  }
                                ]
                              },
                              {
                                "id": "cmp.escritorio.distribuicao.distribuicao_interna.j1_advogado.v01::18",
                                "tag": "button",
                                "atributos": {
                                  "class": "button",
                                  "type": "submit"
                                },
                                "filhos": [
                                  "Salvar"
                                ]
                              },
                              {
                                "id": "cmp.escritorio.distribuicao.distribuicao_interna.j1_advogado.v01::19",
                                "tag": "button",
                                "atributos": {
                                  "class": "op-secondary",
                                  "type": "button",
                                  "data-goto": "escritorio.gestao.escritorio"
                                },
                                "filhos": [
                                  "Voltar"
                                ]
                              }
                            ]
                          },
                          {
                            "id": "cmp.escritorio.distribuicao.distribuicao_interna.j1_advogado.v01::20",
                            "tag": "div",
                            "atributos": {
                              "class": "op-toast",
                              "role": "status",
                              "aria-live": "polite"
                            },
                            "filhos": []
                          }
                        ]
                      }
                    ]
                  }
                ]
              }
            ]
          }
        ]
      }
    ],
    "id": "html_cmp.escritorio.distribuicao.distribuicao_interna.j1_advogado.v01"
  },
  "estilos": {
    "css": "/* escritorio.distribuicao.distribuicao_interna · Distribuição interna */\n\n/* arquivo local da tela; mantenha aqui apenas ajustes específicos deste HTML isolado */\n",
    "id": "css_cmp.escritorio.distribuicao.distribuicao_interna.j1_advogado.v01"
  },
  "interface": {
    "propriedadesAceitas": [],
    "eventosEmitidos": [
      "interacao_simulada"
    ],
    "regraBinding": "Interações são interpretadas pelo motor de prévia a partir de atributos data-*; o componente não consulta arquivos externos."
  },
  "classificacao": {
    "escopo": "advogado",
    "jornadas": [
      "advogado"
    ],
    "localizacaoArvore": {
      "secao": "Componentes",
      "segmentos": [
        "importados",
        "projeto1",
        "escritorio",
        "distribuicao",
        "distribuicao_interna"
      ],
      "chave": "j1_advogado"
    }
  }
}
