{
  "schema": "advogadoja.componente.reutilizavel.v2-proposta",
  "identidade": {
    "id": "cmp.notificacoes.lista.notificacoes.j1_administrador.v01",
    "nome": "Notificações · jornada administrador",
    "tipo": "componente",
    "versao": "1.0.0"
  },
  "estrutura": {
    "formato": "arvore_elementos",
    "arvore": [
      {
        "id": "cmp.notificacoes.lista.notificacoes.j1_administrador.v01::1",
        "tag": "div",
        "atributos": {
          "class": "screen-runtime"
        },
        "filhos": [
          {
            "id": "cmp.notificacoes.lista.notificacoes.j1_administrador.v01::2",
            "tag": "div",
            "atributos": {
              "class": "prototype-screen operational"
            },
            "filhos": [
              {
                "id": "cmp.notificacoes.lista.notificacoes.j1_administrador.v01::3",
                "tag": "div",
                "atributos": {
                  "class": "app-header"
                },
                "filhos": [
                  {
                    "id": "cmp.notificacoes.lista.notificacoes.j1_administrador.v01::4",
                    "tag": "div",
                    "atributos": {},
                    "filhos": []
                  },
                  {
                    "id": "cmp.notificacoes.lista.notificacoes.j1_administrador.v01::5",
                    "tag": "div",
                    "atributos": {
                      "class": "app-brand"
                    },
                    "filhos": [
                      {
                        "id": "cmp.notificacoes.lista.notificacoes.j1_administrador.v01::6",
                        "tag": "strong",
                        "atributos": {},
                        "filhos": [
                          "AdvogadoJá"
                        ]
                      }
                    ]
                  },
                  {
                    "id": "cmp.notificacoes.lista.notificacoes.j1_administrador.v01::7",
                    "tag": "div",
                    "atributos": {
                      "class": "app-role"
                    },
                    "filhos": [
                      "Advogado"
                    ]
                  }
                ]
              },
              {
                "id": "cmp.notificacoes.lista.notificacoes.j1_administrador.v01::8",
                "tag": "div",
                "atributos": {
                  "class": "app-titlebar"
                },
                "filhos": [
                  "Notificações"
                ]
              },
              {
                "id": "cmp.notificacoes.lista.notificacoes.j1_administrador.v01::9",
                "tag": "div",
                "atributos": {
                  "class": "screen-layout"
                },
                "filhos": [
                  {
                    "id": "cmp.notificacoes.lista.notificacoes.j1_administrador.v01::10",
                    "tag": "div",
                    "atributos": {
                      "class": "screen-slot screen-slot--main"
                    },
                    "filhos": [
                      {
                        "id": "cmp.notificacoes.lista.notificacoes.j1_administrador.v01::11",
                        "tag": "main",
                        "atributos": {
                          "class": "op-shell"
                        },
                        "filhos": [
                          {
                            "id": "cmp.notificacoes.lista.notificacoes.j1_administrador.v01::12",
                            "tag": "div",
                            "atributos": {
                              "class": "op-empty"
                            },
                            "filhos": [
                              "Nenhuma notificacao"
                            ]
                          },
                          {
                            "id": "cmp.notificacoes.lista.notificacoes.j1_administrador.v01::13",
                            "tag": "div",
                            "atributos": {
                              "class": "op-toast",
                              "role": "status",
                              "aria-live": "polite"
                            },
                            "filhos": []
                          }
                        ]
                      }
                    ]
                  }
                ]
              }
            ]
          }
        ]
      }
    ],
    "id": "html_cmp.notificacoes.lista.notificacoes.j1_administrador.v01"
  },
  "estilos": {
    "css": "/* notificacoes.lista.notificacoes · Notificações */\n\n/* arquivo local da tela; mantenha aqui apenas ajustes específicos deste HTML isolado */\n",
    "id": "css_cmp.notificacoes.lista.notificacoes.j1_administrador.v01"
  },
  "interface": {
    "propriedadesAceitas": [],
    "eventosEmitidos": [
      "interacao_simulada"
    ],
    "regraBinding": "Interações são interpretadas pelo motor de prévia a partir de atributos data-*; o componente não consulta arquivos externos."
  },
  "classificacao": {
    "escopo": "administrador",
    "jornadas": [
      "administrador"
    ],
    "localizacaoArvore": {
      "secao": "Componentes",
      "segmentos": [
        "importados",
        "projeto1",
        "notificacoes",
        "lista",
        "notificacoes"
      ],
      "chave": "j1_administrador"
    }
  }
}
